{
  "profile": "CDL-DETERMINISTIC-1.0",
  "version": "1.0",
  "status": "proposed-standard",
  "base": "CDL-1.5",
  "classes": [
    "ai-assisted",
    "ai-generated",
    "ai-gpai-model",
    "ai-gpai-systemic-risk",
    "ai-high-risk",
    "ai-limited-risk",
    "ai-minimal-risk",
    "ai-unacceptable-risk",
    "ccpa-subject",
    "confidential",
    "coppa-subject",
    "credentials",
    "deepfake",
    "developmental-disability-information",
    "directory-information",
    "educational-record",
    "employment-record",
    "export-controlled",
    "financial",
    "gdpr-subject",
    "genetic-information",
    "hiv-information",
    "internal",
    "legal-privileged",
    "low",
    "minor-health-information",
    "normal",
    "pci",
    "phi",
    "pii",
    "psychiatric-information",
    "public",
    "reproductive-health-information",
    "restricted",
    "secret",
    "sexual-violence-information",
    "social-services-information",
    "substance-use-information",
    "synthetic-media",
    "taboo-information"
  ],
  "capabilities": [
    "42-cfr-part-2-compliant",
    "accountable-transparent-ai",
    "appears-in-directory",
    "builds-profiles",
    "can-aggregate",
    "can-cache",
    "can-call-external-api",
    "can-create-audit-trail",
    "can-de-identify",
    "can-derive",
    "can-display",
    "can-display-to-operator",
    "can-distribute",
    "can-execute",
    "can-extract",
    "can-index",
    "can-modify",
    "can-post-to-web",
    "can-print",
    "can-process-phi",
    "can-send-email",
    "can-send-sms",
    "can-share",
    "can-transform",
    "can-translate",
    "can-transmit-externally",
    "can-write-database",
    "can-write-filesystem",
    "can-write-storage",
    "checks-operator-role",
    "collects-data",
    "collects-derived-only",
    "commercial-use",
    "creates-audit-trail",
    "creates-embeddings",
    "discloses-ai-nature",
    "discloses-to-data-subject",
    "discloses-to-government",
    "displays-raw-data",
    "documents-risk-management-system",
    "encrypts-at-rest",
    "encrypts-in-transit",
    "encrypts-in-use",
    "enforces-mfa",
    "enforces-rbac",
    "enforces-share-alike",
    "eu-ai-act-compliant",
    "explainable-ai",
    "fair-bias-managed-ai",
    "gates-subject-disclosure",
    "gdpr-compliant",
    "gina-compliant",
    "hipaa-compliant",
    "indexes-for-rag",
    "interpretable-ai",
    "is-ai-system",
    "is-gpai-model",
    "is-high-risk-ai",
    "iso-iec-27001-certified",
    "iso-iec-42001-certified",
    "logs-data",
    "logs-display-events",
    "logs-operations",
    "makes-automated-decisions",
    "marks-ai-generated-content",
    "nist-ai-rmf-aligned",
    "no-logging",
    "no-training-use",
    "passed-conformity-assessment",
    "persists-data",
    "preserves-attribution",
    "privacy-enhanced-ai",
    "processes-in-jurisdiction-eu",
    "processes-in-jurisdiction-us",
    "processes-in-memory-only",
    "provides-human-oversight",
    "safe-ai",
    "secondary-use",
    "secure-resilient-ai",
    "supports-deletion-after-use",
    "supports-redaction",
    "supports-right-of-access",
    "supports-right-of-erasure",
    "supports-right-of-portability",
    "supports-right-of-rectification",
    "supports-right-to-object",
    "supports-secure-enclave",
    "supports-summarization",
    "tracks-usage",
    "transient-processing-only",
    "used-for-analytics",
    "used-for-model-training",
    "validated-and-reliable",
    "verifies-agreement",
    "verifies-agreement-baa",
    "verifies-agreement-dua",
    "verifies-agreement-mou",
    "verifies-consent-recency",
    "verifies-consent-record",
    "verifies-contract-active",
    "verifies-legal-obligation",
    "verifies-legitimate-interest-assessment",
    "verifies-organizational-policy",
    "verifies-parental-consent",
    "verifies-professional-determination",
    "verifies-public-task-authority",
    "verifies-subject-authorization",
    "verifies-vital-interests"
  ],
  "rules": [
    {
      "id": "class:ai-high-risk",
      "kind": "class",
      "term": "ai-high-risk",
      "conflictUnless": {
        "any": [
          "is-ai-system"
        ],
        "unlessAny": [
          "passed-conformity-assessment"
        ]
      },
      "check": "ai-high-risk",
      "checkWhenAny": [
        "is-ai-system"
      ]
    },
    {
      "id": "class:ai-unacceptable-risk",
      "kind": "class",
      "term": "ai-unacceptable-risk",
      "conflictAny": [
        "is-ai-system"
      ]
    },
    {
      "id": "covenant:42-cfr-part-2",
      "kind": "covenant",
      "term": "42-cfr-part-2",
      "requireAll": [
        "42-cfr-part-2-compliant"
      ],
      "check": "42-cfr-part-2"
    },
    {
      "id": "covenant:accountable-transparent-ai-required",
      "kind": "covenant",
      "term": "accountable-transparent-ai-required",
      "requireAll": [
        "accountable-transparent-ai"
      ],
      "check": "accountable-transparent-ai-required"
    },
    {
      "id": "covenant:agreement-required",
      "kind": "covenant",
      "term": "agreement-required",
      "requireAll": [
        "verifies-agreement"
      ],
      "check": "agreement-required"
    },
    {
      "id": "covenant:agreement-required-baa",
      "kind": "covenant",
      "term": "agreement-required-baa",
      "requireAll": [
        "verifies-agreement-baa"
      ],
      "check": "agreement-required-baa"
    },
    {
      "id": "covenant:agreement-required-dua",
      "kind": "covenant",
      "term": "agreement-required-dua",
      "requireAll": [
        "verifies-agreement-dua"
      ],
      "check": "agreement-required-dua"
    },
    {
      "id": "covenant:agreement-required-mou",
      "kind": "covenant",
      "term": "agreement-required-mou",
      "requireAll": [
        "verifies-agreement-mou"
      ],
      "check": "agreement-required-mou"
    },
    {
      "id": "covenant:ai-generated-content-marked",
      "kind": "covenant",
      "term": "ai-generated-content-marked",
      "requireAll": [
        "marks-ai-generated-content"
      ],
      "check": "ai-generated-content-marked"
    },
    {
      "id": "covenant:attribution-required",
      "kind": "covenant",
      "term": "attribution-required",
      "requireAll": [
        "preserves-attribution"
      ],
      "check": "attribution-required"
    },
    {
      "id": "covenant:audit-on-display",
      "kind": "covenant",
      "term": "audit-on-display",
      "requireAll": [
        "logs-display-events"
      ],
      "check": "audit-on-display"
    },
    {
      "id": "covenant:audit-required",
      "kind": "covenant",
      "term": "audit-required",
      "requireAny": [
        "creates-audit-trail",
        "logs-operations"
      ],
      "check": "audit-required"
    },
    {
      "id": "covenant:conformity-assessment-required",
      "kind": "covenant",
      "term": "conformity-assessment-required",
      "requireAll": [
        "passed-conformity-assessment"
      ],
      "check": "conformity-assessment-required"
    },
    {
      "id": "covenant:consent-current-required",
      "kind": "covenant",
      "term": "consent-current-required",
      "requireAll": [
        "verifies-consent-recency"
      ],
      "check": "consent-current-required"
    },
    {
      "id": "covenant:de-identification-required",
      "kind": "covenant",
      "term": "de-identification-required",
      "requireAll": [
        "can-de-identify"
      ],
      "check": "de-identification-required"
    },
    {
      "id": "covenant:delete-after-use",
      "kind": "covenant",
      "term": "delete-after-use",
      "requireAll": [
        "supports-deletion-after-use"
      ],
      "check": "delete-after-use"
    },
    {
      "id": "covenant:encryption-in-use",
      "kind": "covenant",
      "term": "encryption-in-use",
      "requireAny": [
        "encrypts-in-use",
        "supports-secure-enclave"
      ],
      "check": "encryption-in-use"
    },
    {
      "id": "covenant:encryption-required",
      "kind": "covenant",
      "term": "encryption-required",
      "requireAll": [
        "encrypts-at-rest",
        "encrypts-in-transit"
      ],
      "check": "encryption-required"
    },
    {
      "id": "covenant:eu-ai-act",
      "kind": "covenant",
      "term": "eu-ai-act",
      "requireAll": [
        "eu-ai-act-compliant"
      ],
      "check": "eu-ai-act"
    },
    {
      "id": "covenant:explainable-ai-required",
      "kind": "covenant",
      "term": "explainable-ai-required",
      "requireAll": [
        "explainable-ai"
      ],
      "check": "explainable-ai-required"
    },
    {
      "id": "covenant:fair-bias-managed-required",
      "kind": "covenant",
      "term": "fair-bias-managed-required",
      "requireAll": [
        "fair-bias-managed-ai"
      ],
      "check": "fair-bias-managed-required"
    },
    {
      "id": "covenant:gdpr",
      "kind": "covenant",
      "term": "gdpr",
      "requireAll": [
        "gdpr-compliant"
      ],
      "check": "gdpr"
    },
    {
      "id": "covenant:gina",
      "kind": "covenant",
      "term": "gina",
      "requireAll": [
        "gina-compliant"
      ],
      "check": "gina"
    },
    {
      "id": "covenant:hipaa",
      "kind": "covenant",
      "term": "hipaa",
      "requireAll": [
        "can-process-phi",
        "hipaa-compliant"
      ],
      "check": "hipaa"
    },
    {
      "id": "covenant:human-oversight-required",
      "kind": "covenant",
      "term": "human-oversight-required",
      "requireAll": [
        "provides-human-oversight"
      ],
      "check": "human-oversight-required"
    },
    {
      "id": "covenant:interpretable-ai-required",
      "kind": "covenant",
      "term": "interpretable-ai-required",
      "requireAll": [
        "interpretable-ai"
      ],
      "check": "interpretable-ai-required"
    },
    {
      "id": "covenant:iso-iec-27001",
      "kind": "covenant",